<?xml version="1.0" encoding="UTF-8"?>
<!DOCTYPE comedyArchive [
	<!ENTITY mrBeanWisdom "Funny faces speak louder than words.">
]>
<?xml-stylesheet type="text/xsl" href="comedy-style.xsl"?>
<!-- Global Comedy Archive -->
<!-- It is just an example, generated by LLM. Some data may be invalid :) -->
<comedyArchive xmlns="http://example.org/comedy"
               xmlns:cm="http://example.org/comedy"
               xmlns:xsi="http://www.w3.org/2001/XMLSchema-instance"
               xsi:schemaLocation="http://example.org/comedy comedy.xsd">

	<metadata>
		<compiledBy>Артур</compiledBy>
		<compiledOn>2025-10-25T19:30:00+03:00</compiledOn>
		<theme><![CDATA[Exploring the joyful absurdity of human culture through comedy.]]></theme>
	</metadata>

	<performers>
		<cm:comedian id="c001" nationality="Ukrainian">
			<cm:name>Serhiy Prytula</cm:name>
			<cm:style>Satire</cm:style>
			<cm:languages>
				<language>uk</language>
				<language>en</language>
			</cm:languages>
			<cm:quote><![CDATA[Politics is the only circus where the clowns are in charge.]]></cm:quote>
		</cm:comedian>

		<cm:comedian id="c002" nationality="British">
			<cm:name>Rowan Atkinson</cm:name>
			<cm:style>Physical Comedy</cm:style>
			<cm:languages>
				<language>en</language>
			</cm:languages>
			<cm:quote>&mrBeanWisdom;</cm:quote>
		</cm:comedian>
	</performers>

	<events>
		<event id="e001" type="festival">
			<title>Global Laugh Fest</title>
			<location city="Kyiv" country="Ukraine"/>
			<date>2025-12-01</date>
			<acts>
				<act ref="c001"/>
				<act ref="c002"/>
			</acts>
		</event>
	</events>

	<genres>
		<genre name="Satire" origin="Ancient Greece"/>
		<genre name="Slapstick" origin="Italy"/>
		<genre name="Stand-up" origin="USA"/>
		<genre name="Sketch" origin="UK"/>
	</genres>

	<config>
		<setting name="defaultLanguage" value="en"/>
		<setting name="maxEventDuration" value="180"/>
		<setting name="allowImprovisation" value="true"/>
	</config>

</comedyArchive>